term,definition,parent,plural
Halle and Oldeman Architectural models,-,Branching_pattern,
Hastate,"Of a leaf blade, narrow with two basal lobes directed outwards, like some types of arrow-head.",Leaf_base,
Head,A racemose inflorescence with unstalked flowers aggregated in a dense cluster.,Inflorescence_type,Heads
Heliophilous,"'Sun loving'; typical of forest gaps, road-sides, savanna.",Guilds,
Herb,"A generally small plant without woody stems, without bark.",Habit,
Herb (larger types >1m),-,Herb,
Herb (small   annuals),-,Herb,
Herb(monocot),-,Herb,
Herbaceous,"Not woody; soft often green, stems (even on non-herbs) having the texture of a herb stem.",Habit,
Hermaphrodite,"(Flower or plant) of both sexes, i.e. with both stamens and ovary, bisexual.",Gender,
Hilum,The scar on a seed indicating its point of attachment.,Seed,
Hirsute,"With long, coarse, and fairly stiff hairs; hairs erect, completely covering surface.",Hairs,
Hirtellous,Minutely hirsute: with shorter hairs,Hairs,
Hispid,"With bristles or (very) long, stiff, bristly hairs. Hairs stiffer and slightly sparser than hirsute.",Hairs,
Holotype,"A single specimen designated by the author of a plant name, at the time of original publication, which fixes the application of the",Type_specimen,
Hoop,"(On bark) narrow circle of distinct texture or colour running round tree, twig, etc.",Bole,
Hyaline,"Colourless, transparent, used mainly for thickened part of some leaf margins.",Transparency,
Hybrid,"The offspring of two different taxa (species, sub-species etc.), intermediate in character between the parent taxa.",Genetics,
Hydathode,Structures (glands) usually on a leaf margin that secrete water (guttation),Surface_details,
Hyphodromous,"With a single primary vein and all other venation absent, rudimentary or concealed within a coriaceous or fleshy blade.",Leaf_venation_(hickey),
Idioblast,"Small structure, generally of unknown of unspecified function, different in form from adjacent tissues; often referred to as 'gland",Gland_dots,
Imbricate,Overlapping like tiles on a roof.,Aestivation,
Imparipinnate,"(Pinnate leaf) with leaflets that are not all paired (leaflets either alternate, or opposite except for a solitary terminal leaflet",Pinnate_leaf,
Imparipinnate  a (alternate or almost so),-,Imparipinnate,
Imparipinnate 2n+1 (lflets paired except terminal),-,Imparipinnate,
Impressed,"Raised line or ridge (of nerves, etc.) which lies as if pressed into the surface which bears it. Sharply impressed means the depres",Vein_prominence,
Incised,"Margins sharply and deeply cut, usually jaggedly.",Serrated,
Incrassate,Thickened.,Texture,
Indehiscent,"(Fleshy fruit) not splitting open at maturity, e.g. drupe or berry. Opposite of dehiscent.",Fruit_type,
Indumentum,"The covering of hairs (or other epidermal appendages, e.g. scales) of a plant.",Hairs,
Indumentum (hairs etc),-,Hairs,
Indurate,Hardened.,Texture,
Inermous,Unarmed. Without prickles or spines.,Spines__prickles_etc,
Inferior Ovary,"Ovary developing below the point of insertion of petals, etc.; often becoming fruit with calyx remaning at top.",Ovary,Inferior ovaries
Inflorescence,-,Flower_&_fruit,
Inflorescence part,-,Inflorescence,Inflorescence parts
Inflorescence type,"Several/many flowers arranged on a single leafless axis, and maybe including bracts and bracteoles",Inflorescence,Inflorescence types
"Inflorescence, Infructescence",-,Flower_&_fruit,
Infraspecific,Of lower taxonomic rank than species.,Taxonomy,
Infructescence,-,Flower_&_fruit,
Infructescence see Inflorescence  fruits,-,Flower_&_fruit,
Internode,Part of stem between nodes.,Stem,
Interpetiolar,(Stipules) on the stem between the two petioles of opposite leaves.,Node,
Intrapetiolar,"(Stipules) on the stem sandwiched between a petiole and the stem, in the leaf axil.",Position,
Involucre,A whorl or cup of bracts subtending a flower or inflorescence.,Inflorescence_part,Involucres
Involute,-,Margin_of_leaf_blade_(3d),
Isotype,"A specimen which is a duplicate of the holotype, i.e. part of the same collection.",Type_specimen,
Juvenile,"(Whole Plant) Young, infertile stages in life cycle; (Leaf) form associated with juvenile plant, e.g. on coppice shoots.",Vegetative,
Keel,"A prominent longitudinal ridge, like the keel of a boat; in Leguminosae, a boat-shaped structure, formed by the two anterior (lower",Shape__3d,
Keeled,-,Shapes__3d,
Knee Roots,"Parts of root which rise out and bend back into soil/water of swamps, like knees of sunken legs.",Bole,
Knobs,-,Woody_stem,
Lacerate,"Margins irregularly cut, appearing torn.",Serrated,
Laciniate,"Slashed into narrow, ribbon-like (flattened) lobes. See Stipule.",Serrated,
Laevigate,Shiny,Surface_texture,
Lamina  leaf blade,-,Leaf_parts,Leaf blades
Lamina (blade of leaf or leaflet),Flattened green structure repeated many times on tree which normally develops and falls as a unit,Leaf_parts,
Lanate,"Woolly, covered with long, curled and densely matted hairs.",Hairs,
Lanceolate,"Lance-shaped; 3 ? 6 times as long as broad and broadest below middle. See oblanceolate, ovate.",Leaf_blade_shape,
Lateral,i) sideways; ii) abbreviation of lateral nerve   which is a secondary nerve branching from the midrib like a rib.,Position,
Lateral nerve,-,Nerve,
Lateral nerve count (number of pairs),-,Lateral_nerve,
Latex,"Opaque, milk like white or yellow, sticky or rubbery exudate.",Slash,
Latex bright custard yellow or orange,-,Slash_exudate,
Latex white or creamy,-,Slash_exudate,
Laticiferous,Producing latex.,Exudate,
Lax,Loose arrangement; opposite to dense.,Pattern,
Leaf,-,Foliage,
Leaf arrangement,-,Foliage,
Leaf Base,-,Outline_of_leaf_blade,
Leaf blade colour,-,Lamina__leaf_blade,
Leaf Blade glands dots etc,-,Lamina__leaf_blade,
Leaf blade margin,-,Lamina__leaf_blade,
Leaf blade Margin (plane outline),Edge (of leafl,Lamina__leaf_blade,
Leaf blade overall shapes,-,Outline_of_leaf_blade,
Leaf blade shape,-,Lamina__leaf_blade,
Leaf Parts,-,Leaf,
Leaf Parts (compound),-,Leaf_parts,
Leaf Shape,-,Lamina__leaf_blade,
Leaf Types,-,Leaf,
Leaf Venation (Hickey),-,Venation,
Leaflet,"Structure that forms part of a compound leaf but resembles a simple leaf, with one blade and a petiolule.",Parts_of_compound_lvs,
Leaflet count (per pinna),-,Compound_leaf,
Leafy Stem,-,Vegetative,
Lectotype,A specimen selected from among those (syntype) specimens cited with the original description to serve in place of a holotype where,Type_specimen,
Legume,"A fruit type in Leguminosae, or a broad term for any species of Leguminosae.",Fruit_type,
Lenticel,"Small, usually corky structure with enclosed gap on bark or young twigs.",Surface_details,
Lepidote,=Scaly: Covered with minute scales.,Hairs,
Leptocaul,-,Habit,
Liane,"A climbing, woody plant.",Climber,
Liane (=Liana),-,Climber,
Ligneous,=Woody.,Texture,
Ligulate,Having a tongue like outgrowth at base of blade or top of sheath.,Node,
Ligule,"A strap-shaped structure; a membrane or a fringe of hairs between the sheath and the blade of a leaf, especially in grasses.",Node,
Limb,"The expanded part of a petal or tepal; the expanded part of a sympetalous corolla, as distinct from the tube.",Tepal,
Linear,-,Leaf_blade_shape,
Litter-bin habit,"Describes the tendency of some plants to accumulate leaf litter, and eventually even soil, around the stems, due to a tight rosette",Habit,
Lobe,"A division of an organ, as of a leaf.  Simple leaf (or leaflet) with deep (and therefore generally few) irregularities in margin.",Leaf_blade_shape,
Lobe  (n)  Lobed (adj),-,Leaf_blade_shape,
Lobed,-,Leaf_blade_shape,
Locule (number),-,Ovary,Locules
Locules (count),-,Ovary,
Lomentum,"A pod, which at maturity breaks transversally into one-seeded segments.",Fruit_type,
Lyrate,"Shaped like a lyre: i.e. lobed, with a large terminal lobe and smaller lateral lobes.",Leaf_blade_shape,
Mangrove,-,Swamp_forest,
Marcescent,"Withering without falling off, as the sepals and petals in some flowers or the leaves at the base of some plants.",Texture,
Margin of leaf blade (3D),-,Leaf_blade_margin,
MARGIN RECURVED,-,Margin_of_leaf_blade_(3d),
Marginal,"(Nerve, gland) situated on the margin (sub marginal = very close to and following margin); marginal placentation = having the ovule",Position,
Membranous,"?Like a membrane?, i.e. thin, soft, flexible, and more or less translucent. Leaves thinner than papery.",Texture,
Mericarp,A one-seeded portion of a many-seeded fruit that breaks at maturity into units.,Fruit_type,
Merous,"The number of parts per whorl that characterizes a particular flower, e.g., 5-merous, pentamerous, having five parts.",General_part_terms,
Mesocarp,"The middle layer in a fruit wall, often fleshy and edible in a drupe, sometimes missing.",Fruit_details,
Micro,-,Surface_details,
Micro Surface Details,-,Surface_details,
Microscopic Surface Details,-,Plant_parts,
Midrib,"Central and largest channel or vein e.g. of leaf, stipule, petals, bract.",Venation,
Midrib lower surface,-,Midrib,
Midrib upper surface,-,Midrib,
Monadelphous,"Of stamens, with the filaments united into one bundle.",Androecium,
Monocarp,One of several fruit parts derived from (the separate carpels of) a single flower in  a few families where the carpels remain free.,Gynoecium,
Monochasium,A cyme with one branch from each node.,Inflorescence_type,Monochasia
Monocot habit (large or woody and palm like),-,Habit,
Monocot small habit (musoid grasses lillies etc),-,Habit,
Monocotyledon,"Broad category of flowering plant, with one seedling leaf  e.g. palms and grasses mostly with many nerves running parallel.",Habit,
Monoecious,"With separate male and female flowers, but both sexes on one plant (see dioecious).",Gender,
Monopodial,-,Branching_pattern,
Monotypic,"With only one taxon of the next lower rank, e.g. a family containing only one genus.",Taxonomy,
Mosaic,Pattern made up of many closely fitting pieces.,Pattern,
Mucro,-,Apex_of_leaf_blade,
Mucronate,Tip of leaf with a stiff narrow process (mucro) on end of midrib. According to some strict definitions the point is less than 3 tim,Apex_of_leaf_blade,
Mucronulate,1:1 l/w or broader than long; straight.,Apex_of_leaf_blade,
Muricate,"Covered with short, hard protuberances.",Surface_texture,
Nectar,"Sugary, watery fluid generally secreted to attract animals.",Glands_(large_types),
Nectary,A nectar-secreting gland.,Glands_(large_types),
Neotype,"A specimen selected to serve in place of a holotype, where none of the original material to which the name was originally applied i",Type_specimen,
Nerve,"(Major) channel in lamina after midrib (see marginal, basal, lateral and vein).",Venation,
Nitid,"Lustrous, polished, shiny. (not used in this book, but a reason for so many of our species to be called ?nitida?).",Surface_texture,
Nodding,"Bending very much, so that the apex is directed downwards.",Stem,
Node,"Place on stem where leaves, flowers or branches arise or have fallen.",Stem,
Nut,"1. Strictly, a hard, dry, indehiscent, single-seeded fruit with a hard dry pericarp (the shell); a nutlet is a small nut. 2. Howeve",Indehiscent,Nuts
Obconical,"Conical, but attached at the narrower end.",Shape__3d,
Oblanceolate,"As lanceolate, but broadest part is beyond the middle of the longer axis.",Leaf_blade_shape,
Oblate,Almost circular but wider than long.,Leaf_blade_shape,
Oblique,Having an asymmetrical base.,Leaf_base,
Oblong,"Leaf roughly broadest in middle with almost parallel sides, c. 1.5-2 times  as long as wide (narrowly or broadly oblong or even squ",Leaf_blade_shape,
Obovate,"As OVATE, but broadest beyond middle; c1.2-3x as long as wide.",Leaf_blade_shape,
Obscure,"Not visible, or not at all clear; if unspecified, then it means here not visible with naked eye (or spectacles if needed) at arm?s",Venation,
Obtuse,Flat-ended or almost so (apex or base).,Apex_of_leaf_blade,
Ochrea   ocrea,-,Node,
Ocreate,With an ochrea,Node,
Ocreolate,Diminutive of ocreate; usually applied to bract bases.,Ochrea,
Opaque,"'Murky'; not possible to see through, and letting little light through.",Transparency,
Opposite leaf,-,Leaf_arrangement,
Orbicular,"A flat shape, circular in outline.",Leaf_blade_shape,
Osseous,Bony.,Texture,
Outline of leaf blade,-,Lamina__leaf_blade,
Ovary,The basal part of the gynoecium containing the ovules.,Gynoecium,
Ovate,"Leaf with outline (roughly) of egg and broadest below middle. Strictly, 2 -1.5 times as long as broad. ""Broadly ovate"" leaves can h",Leaf_blade_shape,
Ovoid,Egg-shaped (three dimensional) structure.,Shape__3d,
Ovule,"Organ (inside the ovary in Angiosperms, open in Gymnosperms) that develops into the seed after fertilization.",Ovary,Ovules
Pachycaul,-,Habit,
Paleaceous,"With small membranous scales, chaffy.",Surface_texture,
Palinactinodromous,"Actinodromous, the primary veins with one or more subsidiary radiations above the primary one.",Leaf_venation_(hickey),
Palm tree,-,Tree_(any_size),
Palmate,"Arranged like fingers on a hand, i.e. with more than three (often 5) lines radiating from main axis. If unspecified, implies a palm",Lobe,
Palmately lobed,(Simple leaf) with lobes and main nerves diverging like fingers on a hand; more than three distinct lobes whose main nerves meet at,Lobe,
Palmately veined,Pattern of nerves with more than 3 basal nerves plus the midrib (whether or not the leaf is lobed as well). See trinerved.,Venation,
Palmatifid,Cut palmately.,Leaf_blade_shape,
Palmatisect,"Palmately divided almost down to the midrib, i.e. almost digitately compound.",Leaf_blade_shape,
Panduriform,"(=Pandurate) Fiddle-shaped, obovate with a sinus in each side below the middlle and small basal lobes.",Leaf_blade_shape,
Panicle,"A compound, much-branched inflorescence, where at least some of the branches have more than one flower.",Inflorescence_type,Panicles
Pannose,With a felty texture.,Leaf_blade_colour,
Papilla,"A (microscopic) short, rounded nipple-like bump or projection of an epidermal cell.",Surface_texture,
Papillose,Covered with papillae.,Surface_texture,
Pappus,"Hairs, simple or feathery, or sometimes bristles or scales formed outside the corolla and surrounding the apex of the fruit, in the",Fruit_details,
Parallelodromous,With two or more primary veins originating beside one another at the blade base and running more or less parallel to the apex where they converge.,Leaf_venation_(hickey),
Parietal,"Attached to the margins of a structure; of a placenta, having the ovules attached to placentas on the wall of the ovary.",Placenta,
Paripinnate,"Pinnate leaf with leaflets all strictly arranged in pairs, all opposite (or sub opposite, very nearly opposite).",Pinnate_leaf,
Parted,Indentations or incisions cut 1/2-3/4 distance to midrib.,General_part_terms,
Pathology,-,Plant_parts,Pathologies
Pattern,-,General_terms,
Pedate,"Palmately lobed but with the lateral lobes themselves divided into smaller segments, the midribs of which do not directly run to th",Lobe,
Pedicel,-,Flower_part,
Pedicellate,-,Flower_part,
Peduncle,-,Inflorescence_part,Peduncles
Peduncle   pedunculate,-,Inflorescence_part,
Pellucid,Letting light through (=translucent ); especially for gland spots in leaf.,Transparency,
Peltate,"Leaf with petiole attached to under-surface, not to edge.",Leaf_blade_shape,
Perennial,A plant that lives for more than two years.,Habit,
Perfoliate,Having base completely surrounding stem.,Leaf_base,
Perianth,"The calyx and corolla, of outer part of most flowers, especially used when there is little difference between petals and sepals.",Flower_part,
Perianth segment,"The lobes of a perianth, especially when sepals and petals cannot be distinguished.",Perianth,Perianth segments
Pericarp,"The fruit wall, developed from the ovary wall, often merely-skin like; see mesocarp.",Fruit_details,
Perigynous,"A flower where the base of the perianth and stamens are carried up around, or raised above the base of the ovary, but are not attac",Flower_part_arrangement,
Perpendicular,"Directed straight downwards, or at right angle with some other body: e.g. the top line of a T is perndedicular to the vertical line",Position,
Persistent,"Remaining attached, not falling off, even though the original function of the organ has ceased, e.g. of petals not falling after fl",Attachment,
Petal,"One of members of inner ring of the perianth, especially if brightly coloured; see corolla.",Corolla,
Petaloid,"Petal-like; used for brightly coloured sepals, bracts or leaves, when these are arranged around the flower.",Perianth,
Petiolate,"With a petiole, not sessile.",Leaf_parts,
Petiole,The stalk by which the midrib or rachis of a leaf is attached to the stem.,Leaf_parts,
Petiole length (non pinnate leaves),-,Petiole_(simple_lf),
Petiole length (pinnate leaves),-,Petiole_(simple_lf),
Petiole of compound leaf,-,Parts_of_compound_lvs,
Petiole_gland_(cpd leaf),-,Gland_(petiole_or_rachis),Petiole_glands_(cpd leaf)
Petiolule,The stalk by which the midrib of a leaflet is attached to the axis of a compound leaf.,Parts_of_compound_lvs,
Phloem,Tissue which conducts sugars and other nutrients; in tree trunks this is found in the cylinder of bark around the wood.,Woody_stem,
Pilose,"Hairy, covered with long, weak, soft, 'shaggy' hairs.",Hairs,
Pinnate leaf,-,Compound_leaf_types,
Pinnately lobed,Of a leaf cut deeply into lobes that diverge from the midrib rather than a single points.,Lobe,
Pinnatifid,"Of a leaf cut deeply into lobes, but not close to the midrib.",Lobe,
Pinnatisect,"Pinnately cut to the midrib but with the base of the resulting segments just meeting up along it, not quite separate.",Lobe,
Pioneer,(Forest) Plant of which seedlings are found only under canopy gaps; i.e. the first plants to appear when a forest is disturbed; the,Guilds,
Pistil,"The female organ of a flower, formed by a single carpel or a group of fused carpels.",Gynoecium,
Pith,Very soft and airy tissue at the centre of stems or roots.,Stem,
Placenta,"The part within an ovary, to which the ovules are attached.",Fruit_details,
Plant Groups,-,Taxonomy,
Plant Parts,-,Taxonomy,
Plant Types,-,Plant_groups,
Pneumatophore,Root attachment arising above water/soil surface in swamps.,Bole,
Pod,-,Fruit_type,
Pollen,The powdery mass of male spores (powdery cells or bundles of cells) shed from the anthers of seed plants.,Anther,
Pollination,-,Flower,
Polymorphic,With more than two distinct morphological variants.,Taxonomy,
Polyploid,Having three or more basic chromosome sets.,Genetics,
Population terms,-,Ecology,
Position,-,General_terms,
Prickle,-,Spines__prickles_etc,
Prickle   prickly,-,Spines__prickles_etc,
Prickly,-,Spines__prickles_etc,
Process,Small structure arising from end of another; outgrowth.,General_shape,
Procumbent,Trailing or spreading along the ground.,Habit,
Prominent,"Raised above surrounding surface; (nerves, etc.) easily felt when stroked with finger.",Vein_prominence,
Prop Root,-,Bole,
Prostrate,Lying flat on the ground.,Habit,
Pseudostipule,"Lower leaflets on PINNATE leaf which, surrounding twig, resemble stipules.",Node,Pseudostipules
Pteridophytes,"Ferns and fern allies, i.e. Lycopsida, Sphenopsida and Filicopsida.",Plant_groups,
Puberulent,-,Hairs,
Pubescent,"Hairy, but neither densely, nor roughly so.",Hairs,
Pulvinate,Petiole which has a pulvinus (or two of them).,Petiole_(simple_lf),
Pulvinus,"A swelling at the base of the petiole, often glandular, jointed (like a knee) or even responsive to touch.",Petiole_(simple_lf),
Punctate,"Spotted with glands (or small, undefined, flat, translucent dots).",Gland_dots,
Pungent,"Strong, slightly alarming smell or taste like black pepper (we do not use this word in the alternative sense of prickly).",Smells,
Pustule,Raised bump or wart-like spot.,Hairs,
Putrid,Disgusting smell = foetid.,Smells,
Pyrene,The ?stone? of a drupe or similar fruit ? sometimes synonymous with but or nutlet.,Fruit_details,
Pyriform,Pear-shaped.,Shapes__3d,
Raceme,"Unbranched, elongated inflorescence with no terminal flower and with the lowest flowers the most developed; individual flowers with",Inflorescence_type,Racemes
Rachis,-,Parts_of_compound_lvs,
Rachis   Rhachis,-,Parts_of_compound_lvs,
Rachis_gland,-,Gland_(petiole_or_rachis),Rachis_glands
Raphide,Cystolith-like crystal structure in the Rubiaceae.,Surface_texture,
Ray floret,-,Floret,Ray flowers
Ray floret  Ray flowers,-,Floret,
Receptacle,-,Flower_part,
Recessed,"(Nerves etc.) sunk below surface, more prominent than surrounding tissues but more sunken in channel than with impressed, veins and",Vein_prominence,
Rectangular,"Box-like, longer than wide or vice versa.",Shapes__3d,
Recurved,"Bent backwards, e.g. margin of leaf rolled over slightly. Revolute margins are more strongly rolled over, but there is no standard",Margin_of_leaf_blade_(3d),
Recurved margin,-,Margin_of_leaf_blade_(3d),
Red exudate (in slash),-,Slash_exudate,
Reflexed,Abruptly curved or bent downward or backward.,Angles,
Reniform,"Kidney-shaped, with shallow sinus and widely rounded margins.",Shapes__3d,
Repand,"Sinus with indentions less than 1/16 distance to midrib or midvein. Apparently a more precise term than undulate, but not used here",Serrated,
Resin,"Resinous exudate, usually of scented hydrocarbons; see resin duct.",Slash_exudate,
Resin duct,-,Leaf_blade_glands_etc,
Resinous exudate,-,Slash_exudate,
Reticulate,Arranged like strings in a net.,Venation,
Reticulodromous,"With a single primary vein, the secondary veins not terminating at the margin and losing their identities near the margin by repeated branching, yielding a dense reticulum.",Leaf_venation_(hickey),
Retuse,Emarginate ending on a rounded or obtuse apex: a stricter definition defines retuse with the sinus depth up to 1/16 distance from a,Apex_of_leaf_blade,
Revolute,"Rolled downwards or backwards; of a leaf, with the margins rolled towards the abaxial (lower) surface, see recurved.",Margin_of_leaf_blade_(3d),
Rhizome,"Underground or ground-level, usually horizontally growing stem, often more or less swollen or thickened.",Bole,
Rhombic,-,Leaf_blade_shape,
Ripple Mark,Very fine (,Bark,
Riverine,-,Habitat,
Root,-,Vegetative,Roots
Root climbers (Large stemmed tall),-,Root_climbers_/creepers,
Root climbers (Large),-,Root_climbers_/creepers,
Root climbers and creepers,-,Climber,
Root climbers or creepers (low small types),-,Root_climbers_/creepers,
Root nodule,-,Root,Root nodules
Rosette,A cluster of tightly packed leaves circularly spreading in one plane.,Leaf_arrangement,
Rounded,(Leaf apex with) margins and apex forming a smooth arc.,Shapes__3d,
Rugose,"With a deeply wrinkled surface; intermediate between rough and smooth ?fissures with no sharp edges, waves or wrinkles or there may",Surface_texture,
Rugulose,With minutely wrinkled surface.,Surface_texture,
Ruminate endosperm,"Where the surface is wrapped into the object, brain-like, esp. of seed: very contorted, or convoluted (as if chewed or wrapped up) in X section",Endosperm,
Sagittate,"Of the base of a flat organ, shaped like an arrow-head; of a leaf blade, narrow with two basal lobes directed downwards.",Leaf_base,
Salty,-,Taste,
Samara,-,Fruit_type,
Sapling,-,Juvenile,Saplings
Saprophyte,A plant (usually lacking chlorophyll) which nourishes wholly or mainly from soluble organic compounds in decaying organisms.,Habit,
Savanna,-,Vegetation,
Savanna-woodland,-,Vegetation,
Scabrid,-,Surface_texture,
Scabrid Scabrous,-,Surface_texture,
Scalariform,-,Venation,
Scale,"1. On leaf, a scale is a tiny (",Hairs,Scales
SCALES,-,Hairs,
Scaly,-,Hairs,
Scarious,"Of thin, dry, membranous texture and not green; opposite of herbaceous.",Surface_texture,
Scent,"General term for smell that is not unpleasant, as opposed to foetid.",Smells,
Schizocarp,A dry fruit formed from more than one carpel but breaking apart into single-seeded units (mericarps) when ripe.,Dehiscent,
Scrambler,-,Habit,
Scrambling shrub,"Applied to a plant sprawling over other plants, fences etc. and being supported by these, usually by being anchored with hooks or t",Habit,
Scurfy,With fine flaky covering like rust or dandruff.,Hairs,
Secund,"One-sided, when parts or organs are all directed to the same side (applied especially to the grouping of flowers in an inflorescenc",Inflorescence_type,
Seed,(Part of fruit) derived from single fertilized ovule (ovule contains the  'egg').,Fruit_details,
Seedling,-,Juvenile,
Semicraspedodromous,"With a single primary vein, the secondary veins branching just within the margin, one branch from each terminating at the margin and the other forming a marginal loop and joining the superadjacent secondary vein.",Leaf_venation_(hickey),
Sepal,"One of the lobes of the outer part of perianth, especially if leaf like; see calyx.",Calyx,
Septicidal,(Capsule) opening along the edges of the carpels.,Dehiscent,
Sericeous,"Silky, with a covering of long, appressed, soft, straight and glossy hairs.",Hairs,
Serrate   serrated,-,Leaf_blade_margin,
Serrated,Saw toothed; usually with teeth arching forwards (but cut 1/16-1/8 distance to midrib or midvein) but in this guide a more general,Leaf_blade_margin,
Serrated etc (not entire),-,Leaf_blade_margin,
Serrulate,"Minutely serrate, but cut to 1/16 distance to midrib or midvein.",Serrated,
Sessile,Without a stalk.,Attachment,
Setose,Beset with bristles or fairly sparse stiff hairs.,Hairs,
Shade-Bearer,Plants that can tolerate the full canopy shade of taller trees: the lower layers of undisturbed forest are rich in them.,Guilds,Shade-Bearers
Shade-Bearers,-,Guilds,
Shape  3d,-,General_shape,
Shape (3d),-,General_shape,
Shapes  3d,-,Shape__3d,
Sheath,"A tubular tissue, enveloping another organ; e.g. often prickly layer on rattan stems from base of leaf  enclosing stem below juncti",Node,
Shoot,A young stem or branch.,Stem,
Shoot Details,-,Shoot,
Shrub,"Small woody plant (rarely or not exceeding 5 cm d.b.h., or without bole).",Habit,
Shrublet,-,Shrub,
Sigmoid,Bent like the letter S.,Shapes__3d,
